{
  "valid": true,
  "discovery_complete": true,
  "errors": [],
  "warnings": [
    "candidate_research is missing Discovery candidate ticker(s): 1360, 1579, 2146, 2181, 2477, 285A, 3034, 3103, 3131, 3156, 3277, 3323, 3350, 3374, 3422, 3436, 3664, 3676, 3753, 3926, 4005, 4046, 4052, 4125, 4169, 4360, 4406, 4564, 4597, 4631, 4680, 4689, 4751, 4755, 4813, 4901, 4937, 5016, 5020, 5401, 543A, 5713, 5724, 5801, 5802, 5803, 581A, 5985, 6072, 6098, 6138, 6167, 6239, 6258, 6330, 6425, 6444, 6501, 6570, 6613, 6740, 6743, 6758, 6836, 6869, 6928, 6969, 6976, 6981, 7011, 7012, 7013, 7201, 7203, 7244, 7267, 7272, 7358, 7456, 7550, 7567, 8050, 8136, 8306, 8410, 8593, 8729, 8783, 8801, 8918, 8995, 9432, 9433, 9434, 9501, 9984"
  ]
}
